{
  "$schema": "http://json-schema.org/draft-07/schema#",
  "title": "Routing",
  "type": "object",
  "properties": {
    "id": {"type": "string"},
    "locationId": {"type": "string"},
    "locationCode": {"type": "string"},
    "destinationCountryId": {"type": "string"},
    "authorityLable": {"type": "string"},
    "states": {"type": "array"},
    "description": {"type": "string"},
    "metadata": {"type": "object"}
  },
  "required": ["id","locationId","destinationCountryId","states"],
  "additionalProperties": false
}
